{
  "$schema": "https://json-schema.org/draft/2020-12/schema",
  "$id": "https://github.com/socitix/stx-skills/stx-feature/wave-state.schema.json",
  "title": "wave-state.json",
  "description": "Canonical state for one /stx-feature wave. Agents write ONLY this file; every HTML artifact (requirement-verse, architecture-verse, qa-verse, result, wave-wiki) is rendered from it deterministically by `stx-feature render <wave-dir>`. Never hand-edit a rendered artifact — change this file and re-render. Fields the templates compute at render time (Revisions from escalations[], reviewer_rejection_count from reviewer_verdicts[], total iterations, agent tallies) are deliberately NOT stored here, so they cannot drift.",
  "type": "object",
  "required": ["wave_id", "wave_slug", "status", "initial_request", "features", "config", "persona_versions"],
  "properties": {
    "wave_id": {
      "type": "string",
      "description": "Format: wave-<slug>-<4-char-random>",
      "pattern": "^wave-[a-z0-9-]+-[a-z0-9]{4}$"
    },
    "wave_slug": { "type": "string", "pattern": "^[a-z0-9-]+$" },
    "started_at": { "type": "string", "format": "date-time" },
    "finished_at": { "type": ["string", "null"], "format": "date-time" },
    "status": {
      "enum": ["planning", "gate-1", "gate-2", "gate-3", "dev-wave", "done", "halted-at-cap", "blocked"]
    },
    "initial_request": { "type": "string" },
    "worktree_path": {
      "type": "string",
      "description": "Absolute path to the feature worktree. Set at Step 0.5 before any artifact write."
    },
    "branch": {
      "type": "string",
      "description": "Feature branch name (e.g. feat/wave-<slug>). Set at Step 0.5."
    },
    "main_worktree_path": {
      "type": "string",
      "description": "Absolute path to the main repo checkout. Set at Step 0.5."
    },
    "config": {
      "type": "object",
      "required": ["soft_cap", "hard_cap", "suspicious_ceiling", "max_parallel_devs", "continue_past_dry_run", "vitest_install_allowed", "use_browser_mcp", "commit_policy"],
      "properties": {
        "soft_cap": { "type": "integer", "minimum": 1 },
        "hard_cap": { "type": "integer", "minimum": 1 },
        "suspicious_ceiling": { "type": "integer", "minimum": 1 },
        "max_parallel_devs": { "type": "integer", "minimum": 1 },
        "continue_past_dry_run": { "type": "boolean" },
        "vitest_install_allowed": { "type": "boolean" },
        "use_browser_mcp": { "type": "boolean" },
        "commit_policy": { "enum": ["no-commit", "commit-after-green", "commit-and-pr"] },
        "autonomous": { "type": "boolean", "description": "True when /stx-feature was invoked with --autonomous. When true, the orchestrator auto-approved gates 1/2/3, the worktree confirmation, the Analyst/Architect interview rounds, the continue-past-dry-run choice, and forced commit_policy=\"no-commit\" for close-out. Never bypasses destructive ops, reviewer halt verdicts, or iteration caps." }
      }
    },
    "gates": {
      "type": "array",
      "description": "Audit trail of approvals. One row per gate event. In interactive mode each row is logged after explicit user approval; in --autonomous mode rows are written with auto_approved=true and reason=\"autonomous mode\".",
      "items": {
        "type": "object",
        "required": ["gate", "auto_approved", "approved_at"],
        "properties": {
          "gate": { "enum": ["worktree", "requirement_verse", "architecture_verse", "qa_verse", "post_wave_commit"] },
          "auto_approved": { "type": "boolean" },
          "approved_at": { "type": "string", "format": "date-time" },
          "reason": { "type": "string", "description": "\"autonomous mode\" when auto-approved; free-text or empty when user-approved." }
        }
      }
    },
    "interviews": {
      "type": "array",
      "description": "Orchestrator-run user interviews (subagents cannot reach the user). One row per round: the Step 2 up-front requirement interview plus any open-questions round an agent returned (max 2 rounds per agent per step). Absent in --autonomous waves.",
      "items": {
        "type": "object",
        "required": ["step", "agent", "round", "questions", "answers", "at"],
        "properties": {
          "step": { "type": "integer", "minimum": 2, "maximum": 4 },
          "agent": { "enum": ["orchestrator", "analyst", "architect", "qa"] },
          "round": { "type": "integer", "minimum": 0, "description": "0 = the up-front Step 2 interview; 1..2 = open-questions rounds." },
          "questions": { "type": "array", "items": { "type": "string" } },
          "answers": { "type": "array", "items": { "type": "string" } },
          "at": { "type": "string", "format": "date-time" }
        }
      }
    },
    "out_of_scope_seed": {
      "type": "array",
      "items": { "type": "string" },
      "description": "The out-of-scope items declared at wave start, before the Analyst or Architect added any. Rendered as §2 of requirement-verse.html. Written once at Step 1 and never amended — out_of_scope is the growing list."
    },
    "out_of_scope": {
      "type": "array",
      "items": { "type": "string" },
      "description": "Frozen at Gate 2. Seed (from interview) + Analyst additions + Architect additions. Rendered as §1 of architecture-verse.html."
    },
    "vitest_installed": {
      "enum": ["yes", "no", "not-needed"],
      "description": "Written by QA at Step 4. Whether Vitest ended up configured in the consuming project for this wave. Rendered into the qa-verse.html header."
    },
    "next_action": {
      "type": "string",
      "description": "Written by the orchestrator at Step 8. One line telling the user what to do next (e.g. \"Run /stx-checkin to commit, then /stx-pr-merge to ship.\"). Rendered into §1 of result.html."
    },
    "features": {
      "type": "array",
      "items": {
        "type": "object",
        "required": ["id", "title", "actor", "acceptance_criteria", "tasks", "status"],
        "properties": {
          "id": { "type": "string", "pattern": "^F[0-9]+$" },
          "title": { "type": "string" },
          "actor": { "type": "string" },
          "acceptance_criteria": { "type": "array", "items": { "type": "string" } },
          "existing_system_impact": { "type": "string" },
          "out_of_scope": { "type": "array", "items": { "type": "string" } },
          "status": { "enum": ["todo", "in-progress", "done", "halted"] },
          "tasks": {
            "type": "array",
            "items": {
              "type": "object",
              "required": ["id", "title", "tier", "scope_paths", "depends_on", "status"],
              "properties": {
                "id": { "type": "string", "pattern": "^F[0-9]+-T[0-9]+$" },
                "title": { "type": "string" },
                "tier": { "enum": ["db", "service", "api", "ui"] },
                "scope_paths": { "type": "array", "items": { "type": "string" } },
                "depends_on": { "type": "array", "items": { "type": "string" } },
                "acceptance_test_hint": { "type": "string" },
                "existing_patterns_to_follow": { "type": "array", "items": { "type": "string" } },
                "test_path": { "type": ["string", "null"] },
                "test_kind": { "enum": ["playwright", "e2e", "vitest-unit", null] },
                "coverage_summary": { "type": "string", "description": "Written by QA at Step 4. One sentence: what does this task's test assert? Rendered into the qa-verse.html row for this task." },
                "failure_output": { "type": "string", "description": "Written by QA at Step 4. The failing-run output for this task's test, trimmed to the assertion that fails plus enough context to show it fails for the RIGHT reason — not the whole runner dump. Rendered into the collapsed <details> in qa-verse.html." },
                "test_unwritable": {
                  "type": "object",
                  "description": "Written by QA at Step 4 INSTEAD of test_path when no automated test can be authored for this task (timing-sensitive, infra-dependent, etc.). Its presence moves the task into qa-verse.html §2 and is surfaced to the user rather than silently skipped.",
                  "required": ["reason", "manual_protocol"],
                  "properties": {
                    "reason": { "type": "string" },
                    "manual_protocol": { "type": "string", "description": "Proposed manual verification steps." }
                  }
                },
                "status": { "enum": ["todo", "in-progress", "done", "halted", "skipped", "paused"] },
                "iterations_used": { "type": "integer", "minimum": 0 },
                "notes": { "type": "string" }
              }
            }
          }
        }
      }
    },
    "suspicious": {
      "type": "array",
      "description": "Real-time append-only log of scope drift, test-file touches, mocks-of-SUT, and unrelated build breaks.",
      "items": {
        "type": "object",
        "required": ["at", "task_id", "kind", "description", "resolution"],
        "properties": {
          "at": { "type": "string", "format": "date-time" },
          "task_id": { "type": "string" },
          "dev_id": { "type": "string", "description": "Agent run identifier" },
          "kind": { "enum": ["scope-drift", "test-file-touch", "mock-of-sut", "build-break", "out-of-scope"] },
          "description": { "type": "string" },
          "resolution": { "enum": ["resolved", "accepted", "open", "halted"] }
        }
      }
    },
    "escalations": {
      "type": "array",
      "description": "Each soft-cap trip that re-engaged the Architect. Also the SOURCE of the Revisions section (§3) of architecture-verse.html — the Architect appends an entry here instead of editing the rendered HTML, which is what makes \"append a Revision, never overwrite the task\" structurally impossible to violate.",
      "items": {
        "type": "object",
        "required": ["n", "task_id", "at", "trigger"],
        "properties": {
          "n": { "type": "integer", "minimum": 1 },
          "task_id": { "type": "string" },
          "at": { "type": "string", "format": "date-time" },
          "trigger": { "enum": ["soft-cap-hit", "suspicious-ceiling", "qa-pause", "reviewer-halt"] },
          "architect_summary": { "type": "string" }
        }
      }
    },
    "reviewer_verdicts": {
      "type": "array",
      "description": "Append-only log of Reviewer verdicts. One entry per Reviewer spawn (one per Dev hand-back). Feeds Wave 3 metrics — rejection rate per tier, most-common concern kind, concerns that persist past iteration 2.",
      "items": {
        "type": "object",
        "required": ["task_id", "iteration", "at", "approved", "verdict"],
        "properties": {
          "task_id": { "type": "string", "pattern": "^F[0-9]+-T[0-9]+$" },
          "iteration": { "type": "integer", "minimum": 1, "description": "Iteration counter for this task at the time of review." },
          "at": { "type": "string", "format": "date-time" },
          "approved": { "type": "boolean" },
          "verdict": { "enum": ["approved", "concerns", "test-file-edit-detected", "assertion-weakened", "sut-mocked"] },
          "diff_summary": {
            "type": "object",
            "properties": {
              "files_in_scope": { "type": "array", "items": { "type": "string" } },
              "files_out_of_scope": { "type": "array", "items": { "type": "string" } },
              "lines_added": { "type": "integer", "minimum": 0 },
              "lines_removed": { "type": "integer", "minimum": 0 }
            }
          },
          "concerns": {
            "type": "array",
            "items": {
              "type": "object",
              "required": ["kind", "summary", "severity"],
              "properties": {
                "kind": { "enum": ["scope-drift", "pattern-divergence", "result-shape", "typing", "smallest-change", "comment-debt", "error-handling", "smell", "out-of-scope-frozen"] },
                "file": { "type": "string" },
                "line": { "type": "integer" },
                "summary": { "type": "string" },
                "severity": { "enum": ["high", "medium", "low"] }
              }
            }
          },
          "suggested_revisions": {
            "type": "array",
            "items": { "type": "string" }
          }
        }
      }
    },
    "files_touched": {
      "type": "array",
      "items": {
        "type": "object",
        "required": ["path", "add", "del"],
        "properties": {
          "path": { "type": "string" },
          "add": { "type": "integer" },
          "del": { "type": "integer" }
        }
      }
    },
    "agents_spawned": {
      "type": "object",
      "description": "Counts by role for the result.html summary.",
      "properties": {
        "analyst": { "type": "integer" },
        "architect": { "type": "integer" },
        "qa": { "type": "integer" },
        "reviewer": { "type": "integer" },
        "dev": { "type": "integer" }
      }
    },
    "persona_versions": {
      "type": "object",
      "description": "Snapshot of .claude/agents/*.md version fields at wave start. Locks the wave to a specific persona generation for reproducibility and cross-wave metric aggregation.",
      "required": ["analyst", "architect", "qa", "reviewer", "dev_base", "dev_tier_db", "dev_tier_service", "dev_tier_api", "dev_tier_ui"],
      "properties": {
        "analyst": { "type": "string", "description": "Version of .claude/agents/stx-analyst.md" },
        "architect": { "type": "string", "description": "Version of .claude/agents/stx-architect.md" },
        "qa": { "type": "string", "description": "Version of .claude/agents/stx-qa.md" },
        "reviewer": { "type": "string", "description": "Version of .claude/agents/stx-reviewer.md" },
        "dev_base": { "type": "string", "description": "Version of .claude/agents/stx-dev-base.md" },
        "dev_tier_db": { "type": "string", "description": "Version of .claude/agents/stx-dev-tier-db.md" },
        "dev_tier_service": { "type": "string", "description": "Version of .claude/agents/stx-dev-tier-service.md" },
        "dev_tier_api": { "type": "string", "description": "Version of .claude/agents/stx-dev-tier-api.md" },
        "dev_tier_ui": { "type": "string", "description": "Version of .claude/agents/stx-dev-tier-ui.md" }
      }
    },
    "usage": {
      "type": "object",
      "description": "Token + wall-clock usage for the whole wave. Written by /stx-pr-merge at close-out (before the commit step, so it merges with the PR) by summing message.usage across ~/.claude/projects/<encoded-worktree>/ — every orchestrator session AND every subagent transcript (*/subagents/*.jsonl) — deduped by line uuid. Because each wave owns its worktree, that directory is exactly this wave's spend. Time is started_at -> close-out, wall-clock.",
      "required": ["computed_at", "tokens"],
      "properties": {
        "computed_at": { "type": "string", "format": "date-time", "description": "When the usage block was written." },
        "started_at": { "type": ["string", "null"], "format": "date-time", "description": "Copied from the wave's started_at; null if absent." },
        "ended_at": { "type": "string", "format": "date-time", "description": "Close-out time (= computed_at)." },
        "wall_clock_seconds": { "type": ["integer", "null"], "minimum": 0, "description": "ended_at - started_at, in seconds. Null if started_at is absent/unparseable." },
        "wall_clock_human": { "type": ["string", "null"], "description": "Human-readable duration, e.g. \"2h 2m\"." },
        "tokens": {
          "type": "object",
          "required": ["input", "cache_creation", "cache_read", "output", "total"],
          "properties": {
            "input": { "type": "integer", "minimum": 0 },
            "cache_creation": { "type": "integer", "minimum": 0 },
            "cache_read": { "type": "integer", "minimum": 0 },
            "output": { "type": "integer", "minimum": 0 },
            "total": { "type": "integer", "minimum": 0, "description": "Sum of the four token fields above." }
          }
        },
        "n_sessions": { "type": "integer", "minimum": 0, "description": "Distinct orchestrator session transcripts summed." },
        "n_subagents": { "type": "integer", "minimum": 0, "description": "Subagent transcripts summed (Analyst, Architect, QA, Reviewer, tier Devs)." },
        "notes": { "type": "string", "description": "Flags, e.g. 'no-started-at', 'no-transcripts-found'." }
      }
    }
  }
}
